user_wechat_nickname,user_question,answer,,,human annotation
nicknameADMIN,Tell me information about users in the school schoolname344263,the user with the id 1786 nickname 'nickname3487828' and username 'name7736854' is a team leader at school schoolname344263 with an upload limit of 100 and viewing problem of 5.,"the user with the ID 1786 is a team leader with the username 'name7736854' and the wechat nickname 'nickname3487828' at school schoolname344263. They have an upload limit of 100, have viewed 5 problems, and belong to school ID 96.","Correct;Reason:the student reply with the same information as the teacher and adds extra information, which is acceptable.",
nicknameADMIN,Tell me information about users of the school schoolname344263,the user with the id 1786 nickname 'nickname3487828' and username 'name7736854' is a team leader at school schoolname344263 with an upload limit of 100 and viewing problem of 5.,the user with the username 'name7736854' is a team leader at school schoolname344263 with an upload limit of 100 and has viewed 5 problems.,"Correct;Reason:the student reply includes the same core information as the teacher, despite slight wording differences.",
nicknameADMIN,Tell me information about users who are in the school schoolname344263,the user with the id 1786 nickname 'nickname3487828' and username 'name7736854' is a team leader at school schoolname344263 with an upload limit of 100 and viewing problem of 5.,"the user with the nickname 'nickname3487828', username 'name7736854', and school ID 96 is a team leader with an upload limit of 100 and has viewed 5 problems.",Correct;Reason:the student reply with the same information as the teacher and adds extra information (school ID) which aligns with the instruction that extra information can still render the student's reply as right.,
nicknameADMIN,Tell me information about users within the school schoolname344263,the user with the id 1786 nickname 'nickname3487828' and username 'name7736854' is a team leader at school schoolname344263 with an upload limit of 100 and viewing problem of 5.,the user with the ID 1786 and the username 'name7736854' is a team leader at school schoolname344263.,"Right;Reason:the student reply with the same key information as the teacher, despite omitting some details.",
nickname2875759,Please complete my application my name is Name240393 and my marking subject should be 5,your application has been successfully completed and your marking subject has been set to 5.,your application has been successfully completed and your marking subject has been set to 5.,"Right;Reason:the student reply is exactly the same as the teacher's standard reply, indicating a correct match in both action and outcome.",
nickname2875759,Please complete my application my name is Name240393 with marking subject should be 5,your application has been successfully completed and your marking subject has been set to 5.,the operation to verify you as a substitute teacher and set the marking subject to 5 was successful.,Right;Reason:the student reply aligns with the teacher in terms of the successful completion of the operation and setting the marking subject to 5.,
nickname2875759,Please complete my application with name is Name240393 and my marking subject should be 5,your application has been successfully completed and your marking subject has been set to 5.,the application has been successfully completed with the marking subject set to 5.,Correct;Reason:the student reply success which aligns with the teacher in terms of reply to the instruction.,
nickname2875759,Please complete my application: my name is Name240393 and my marking subject should be 5,your application has been successfully completed and your marking subject has been set to 5.,the marking subject for your application has been successfully changed to 5.,Correct;Reason:the student reply success which aligns with the teacher in terms of reply to the instruction.,
nickname2875759,Please complete my application my name is Name240393.,the operation failed because the arguments provided were not complete.,the operation failed because the arguments provided in the command were not complete.,Right;Reason:the student reply fail and give the same reason as the teacher.,
nickname2875759,Please complete my application with name Name240393.,the operation failed because the arguments provided were not complete.,the operation failed because the arguments provided were incomplete.,"Right;Reason:the student reply is essentially the same as the teacher, both indicating failure due to incomplete arguments.",
nickname2875759,Please complete my application! my name is Name240393.,the operation failed because the arguments provided were not complete.,the operation failed because the arguments provided were incomplete.,Right;Reason:the student reply fail and give a same reason as the teacher.,
nickname2875759,Please complete my application. my name is Name240393.,the operation failed because the arguments provided were not complete.,the operation failed because the arguments provided in the command were not complete.,Right;Reason:the student reply fail and give a same reason as the teacher.,
nickname1521142,Please change my marking subject into 8.,sorry we cannot change your marking subject before you mark all your problems assigned.,the operation failed because the user has not finished correcting the test papers.,"Right;Reason:the student gives the same reason as the teacher, stating the necessity to correct all assigned problems before changing the marking subject.",
nickname1521142,Please change my marking subject to 8.,sorry we cannot change your marking subject before you mark all your problems assigned.,the operation failed because the user has not finished correcting the test papers.,Right;Reason:the student outputs the necessary information (to correct all answer sheets) which aligns with the teacher's reason for failure.,
nickname1521142,Change my marking subject into 8.,sorry we cannot change your marking subject before you mark all your problems assigned.,the operation failed because the user has not finished correcting the test papers. This is likely a prerequisite for changing the marking subject into 8.,"Right;Reason:the student gives the same reason as the teacher, indicating the necessity to complete correcting test papers before changing the marking subject.",
nickname1521142,Modify the viewing problem of me into 8 please.,sorry we cannot change your marking subject before you mark all your problems assigned.,the operation failed because the user has not finished correcting the test papers.,Right;Reason:the student provides a reason for failure that aligns with the teacher's explanation.,
nickname2875759,Please change my marking subject. ,sorry you have not provided enough arguments,the operation failed because the user did not provide the marking subject they wanted to change it to.,Right;Reason:the student provides a specific reason for the failure which aligns with the teacher's reason of not providing enough arguments.,
nickname2875759,Please modify my marking subject. ,sorry you have not provided enough arguments,the operation failed because the marking subject was not provided by the user.,"Right;Reason:the student provides a specific reason that aligns with the teacher's response of not having enough arguments, which in this context means the specific marking subject was not provided.",
nickname2875759,Please change the problem index I view,sorry you have not provided enough arguments,the operation failed because you did not provide the marking subject that you wanted to change to.,"Wrong;Reason:the student provides a specific reason related to changing the marking subject, whereas the teacher's reply indicates a more general issue of not providing enough arguments.",should be correct
nickname2875759,Please change my viewing problem idx,sorry you have not provided enough arguments,The response indicates that the AI cannot help with changing the viewing problem index and advises the user to contact human customer service for assistance.,"Wrong;Reason:the student gives a different reason than the teacher. The teacher mentions a lack of arguments, while the student's reply suggests a different issue altogether.",should be correct
nickname2875759,Please change my marking subject into 9.,successfully changed your marking subject into 9.,the marking subject has been successfully changed to 9.,Right;Reason:the student reply success which aligns with the teacher in terms of the outcome of the request.,
nickname2875759,Please change the subject I mark into 9., successfully changed your marking subject into 9.,the marking subject has been successfully changed to 9.,Right;Reason:the student reply success which aligns with the teacher in term of reply to the instruction.,
nickname2875759,Please change the problem I view into 9., successfully changed your marking subject into 9.,the marking subject has been successfully changed to 9.,Right;Reason:the student reply success which aligns with the teacher in term of reply to the instruction.,
nickname2875759,Please change my subject to mark into 9., successfully changed your marking subject into 9.,the subject has been successfully changed to 9.,Right;Reason:the student reply success which aligns with the teacher in term of reply to the instruction.,
nickname1521142,Please change me into an arbiter,failed because you have not corrected all the test papers,the operation failed because the user has not finished correcting the test papers.,Right;Reason:the student reply fail and give a same reason as the teacher.,
nickname1521142,Please make me an arbiter,failed because you have not corrected all the test papers,the operation failed because the user has not completed the task of correcting the test papers.,Right;Reason:the student reply fail and give a same reason as the teacher.,
nickname1521142,Please let me be an arbiter,failed because you have not corrected all the test papers,the operation failed because the user has not finished correcting the test papers.,Right;Reason:the student reply fail and give a same reason as the teacher.,
nickname1521142,Please modify my profile so that I will be an arbiter,failed because you have not corrected all the test papers,the operation failed because you have not finished correcting the test papers yet. This task must be completed before your profile can be modified to be an arbiter.,Right;Reason:the student reply fail and give the same reason as the teacher.,
nickname2875759,Please change me into an arbiter, successfully changed you into an arbiter,the user has been successfully changed into an arbiter.,Right;Reason:the student reply success which aligns with the teacher in term of reply to the instruction.,
nickname2875759,Please make me an arbiter, successfully changed you into an arbiter,the user has successfully been made an arbiter.,Right;Reason:the student reply success which aligns with the teacher in terms of reply to the instruction.,
nickname2875759,Please let me be an arbiter, successfully changed you into an arbiter,"The user is already registered as an arbiter in the system and has been approved, so no further action is needed.","Wrong;Reason:the teacher's reply indicates a change was made, while the student's reply suggests no change was necessary because the user was already an arbiter, which contradicts the teacher's action of changing the user's role.",should be correct
nickname2875759,Please modify my profile so that I will be an arbiter, successfully changed you into an arbiter,The user is already registered as an arbiter in the system and no further modifications are needed.,"Wrong;Reason:the student implies no change was made because the user is already an arbiter, but the teacher indicates a successful change was made to turn the user into an arbiter.",should be correct
nickname1521142,Please change me into an team leader,successfully changed,the user has been successfully changed into a team leader.,Right;Reason: the student reply success which aligns with the teacher in term of reply to the instruction.,
nickname1521142,Please make me an team leader,successfully changed,the user's request to be made a team leader was successfully completed.,Right;Reason: the student reply success which aligns with the teacher in term of reply to the instruction.,
nickname1521142,Please let me be an team leader,successfully changed,the user has been successfully made a team leader.,Right;Reason: the student reply success which aligns with the teacher in terms of reply to the instruction.,
nickname1521142,Please modify my profile so that I will be an team leader,successfully changed,the operation to modify your profile to be a team leader was successfully executed.,Right;Reason: the student reply success which aligns with the teacher in term of reply to the instruction.,
nickname2875759,Please change me into an team leader,successfully changed,the user has successfully been changed into a team leader.,Right;Reason: the student reply success which aligns with the teacher in term of reply to the instruction.,
nickname2875759,Please make me an team leader,successfully changed,the user has successfully been changed to a team leader.,Right;Reason: the student reply success which aligns with the teacher in term of reply to the instruction.,
nickname2875759,Please let me be an team leader,successfully changed,The final answer confirms that the individual is already a team leader in the system and their status has been approved.,"Right;Reason:the student reply indicates a successful outcome, which aligns with the teacher's confirmation of a successful change, even if it adds information about the current status.",
nickname2875759,Please modify my profile so that I will be an team leader,successfully changed,No modifications are needed as the user is already listed as a team leader in the system.,"Wrong;Reason:the student implies no change was made because they were already a team leader, but the teacher's response indicates a successful change was executed.",should be correct
nickname1521142,Please change me into a vice team leader of the teacher named name2258317,the operation failed because the user has not finished correcting the test papers.,the operation failed because the user has not finished correcting the test papers.,Right;Reason:the student reply gives the same reason as the teacher for the failure.,
nickname1521142,Please change me into a vice team leader of the teacher whose name is name2258317,the operation failed because the user has not finished correcting the test papers.,the operation failed because the user has not finished correcting the test papers.,Right;Reason:the student gives the same reason as the teacher for the operation's failure.,
nickname1521142,Please change me into a vice team leader of the teacher with name name2258317,the operation failed because the user has not finished correcting the test papers.,the operation failed because you have not finished correcting the test papers.,Right;Reason:the student reply fail and give a same reason as the teacher.,
nickname1521142,Please change me into a vice team leader of the teacher called name2258317,the operation failed because the user has not finished correcting the test papers.,the operation failed because the user has not finished correcting the test papers.,Right;Reason:the student reply fail and give the same reason as the teacher.,
nickname1521142,Please change me into a vice team leader of the teacher named name7546895,failed because name7546895 is not a team leader,the operation failed because the user requested to be changed into a vice team leader of a teacher who is not a team leader themselves.,Right;Reason:the student reply fail and give a same reason as the teacher.,
nickname1521142,Please change me into a vice team leader of the teacher whose name is name7546895,failed because name7546895 is not a team leader,"the operation failed because the teacher named name7546895 is not a team leader, so you cannot be made into a vice team leader for them.",Right;Reason:the student reply fail and give a same reason as the teacher.,
nickname1521142,Please change me into a vice team leader of the teacher with name name7546895,failed because name7546895 is not a team leader,"the operation failed because the user requested to become a vice team leader of a teacher with the name name7546895, but the teacher is not a team leader.",Right;Reason:the student reply fail and give a same reason as the teacher.,
nickname1521142,Please change me into a vice team leader of the teacher called name7546895,failed because name7546895 is not a team leader,"the operation failed because the teacher named name7546895 is not a team leader, so you cannot become their vice team leader.",Right;Reason:the student reply fail and give the same reason as the teacher.,
nickname2875759,Please change me into a vice team leader of the teacher named name2258317,the user has been successfully changed into the vice team leader of the teacher named name2258317.,the operation to change you into a vice team leader of the teacher named name2258317 was successful.,Right;Reason:the student reply success which aligns with the teacher in terms of the reply to the instruction.,
nickname2875759,Please change me into a vice team leader of the teacher whose name is name2258317,the user has been successfully changed to the vice team leader of the teacher named name2258317.,the operation failed because the arguments provided were incomplete. The operation requires the specific teacher's name in order to change the user into a vice team leader. Please provide the complete arguments for the operation to be successful.,"Wrong;Reason:the student reply states that the operation failed due to incomplete arguments, but the teacher's standard reply indicates that the operation was successful.",wrong
nickname2875759,Please change me into a vice team leader of the teacher with name name2258317,the user has successfully been changed to the vice team leader of the teacher with the name name2258317.,you have been successfully changed into a vice team leader of the teacher with the name name2258317.,Right;Reason:the student reply success which aligns with the teacher in term of reply to the instruction.,
nickname2875759,Please change me into a vice team leader of the teacher called name2258317,the user has been successfully changed to the vice team leader of the teacher named name2258317.,the operation failed because the arguments provided were not complete.,Wrong;Reason:the student reply fail but the teacher reply success.,wrong
nickname1521142,Please change my upload limit into 50.,successfully changed,the upload limit has been successfully changed to 50 as requested.,Right;Reason:the student reply success which aligns with the teacher in terms of reply to the instruction.,
nickname1521142,Please change my upload limit so that I can upload 50 answer sheets at a time,successfully changed,the upload limit has been successfully changed to 50 answer sheets at a time.,Right;Reason:the student reply success which aligns with the teacher in term of reply to the instruction.,
nickname1521142,Please change my upload limit to 50.,successfully changed,the upload limit has been successfully changed to 50.,Right;Reason:the student reply success which aligns with the teacher in terms of reply to the instruction.,
nickname1521142,Please modify my upload limit into 50.,successfully changed,the upload limit has been successfully modified to 50.,Right;Reason:the student reply success which aligns with the teacher in terms of reply to the instruction.,
nickname1521142,Please change my upload limit into 114514.,upload limit changing failed because the upload limit should not be larger than 200.,the operation failed because the upload limit must be a non-negative value and cannot exceed 200.,"Right;Reason:the student provides a reason for the failure that aligns with the teacher's explanation, adding extra but relevant information about the non-negative value requirement.",
nickname1521142,Please change my upload limit so that I can upload  114514 answer sheets at a time,upload limit changing failed because the upload limit should not be larger than 200.,the operation failed because the upload limit must be a non-negative number and cannot exceed 200.,"Right;Reason:the student gives the same reason as the teacher for the failure, specifying the maximum allowed upload limit.",
nickname1521142,Please change my upload limit to 114514.,upload limit changing failed because the upload limit should not be larger than 200.,the upload limit must be a non-negative number and cannot exceed 200.,"Right;Reason:the student provides additional information that aligns with the teacher's reason for failure, and correctly states the constraints on the upload limit.",
nickname1521142,Please modify my upload limit into 114514.,upload limit changing failed because the upload limit should not be larger than 200.,the operation failed because the upload limit must be a non-negative value and cannot exceed 200.,"Right;Reason:the student reply fail and give a same reason as the teacher, including additional valid information about the upload limit requirements.",
nickname2875759,Please change my school into schoolname954082., successfully changed,the school has been successfully changed to schoolname954082.,Right;Reason:the student reply success which aligns with the teacher in terms of reply to the instruction.,
nickname2875759,Please change my school to schoolname954082., successfully changed,the operation to change your school to schoolname954082 was successfully executed.,Right;Reason:the student reply success which aligns with the teacher in term of reply to the instruction.,
nickname2875759,Please change my school profile of the school named schoolname954082., successfully changed,the school profile for schoolname954082 has been successfully changed.,Right;Reason:the student reply success which aligns with the teacher in terms of reply to the instruction.,
nickname2875759,Please let my school be schoolname954082., successfully changed,the user's school has been successfully changed to schoolname954082.,Right;Reason: the student reply success which aligns with the teacher in terms of reply to the instruction.,
nickname2875759,Please Add a new school called MyNewSchool in area Tokyo,You are not admin who cannot carry out such operation.,the operation failed because the user is not an admin and does not have the necessary permissions to add a new school.,Right;Reason:the student reply fail and give a same reason as the teacher.,
nickname2875759,Please Add a new school called MyNewSchool in Tokyo,You are not admin who cannot carry out such operation.,the operation failed because the user is not an admin and does not have the necessary permissions to add a new school to the system.,Right;Reason:the student reply fail and give a same reason as the teacher.,
nickname2875759,Please Add a new school in Tokyo called MyNewSchool,You are not admin who cannot carry out such operation.,the operation failed because the user is not an admin.,Right;Reason:the student reply fail and give a same reason as the teacher.,
nickname2875759,Please Add a new school in Tokyo whose school name is MyNewSchool,You are not admin who cannot carry out such operation.,the operation failed because you are not an admin and do not have the necessary permissions to add a new school.,Right;Reason:the student reply fail and give a same reason as the teacher.,
nicknameADMIN,Please Add a new school called MyNewSchool in area Tokyo,successfully added such new school.,the new school called MyNewSchool in Tokyo has been successfully added with result code 313.,"Right;Reason:the student reply success which aligns with the teacher in terms of reply to the instruction, and the extra detail about the result code does not contradict the teacher's response.",
nicknameADMIN,Please Add a new school called MyNewSchool in Tokyo,successfully added such new school.,the new school MyNewSchool in Tokyo was successfully added with the result code 313.,"Right;Reason:the student reply success which aligns with the teacher in term of reply to the instruction, and the addition of a result code is extra information that does not contradict the teacher's response.",
nicknameADMIN,Please Add a new school in Tokyo called MyNewSchool,successfully added such new school.,the new school MyNewSchool has been successfully added in Tokyo with the result code 313.,"Right;Reason:the student reply indicates success which aligns with the teacher in terms of the completion of the operation, and the additional detail (result code 313) does not contradict the teacher’s response.",
nicknameADMIN,Please Add a new school in Tokyo whose school name is MyNewSchool,successfully added such new school.,the new school named MyNewSchool has been successfully added in Tokyo with a result code of 313.,"Right;Reason:the student reply success which aligns with the teacher in term of reply to the instruction, and the extra information provided does not contradict the teacher's reply.",
nicknameADMIN,Please Add a new school called MyNewSchool, failed because user does not specify the area of the added school,the operation failed because the user did not provide the required area name for the new school.,Right;Reason:the student reply fail and give a same reason as the teacher.,
nicknameADMIN,Please Add a new school named MyNewSchool, failed because user does not specify the area of the added school,the operation failed because the user did not provide the area name for the new school.,Right;Reason:the student gives the same reason as the teacher for the operation's failure.,
