user_wechat_nickname,user_question,answer,,,human annotation
nicknameADMIN,Please Add a new school of MyNewSchool, failed because user does not specify the area of the added school,"the operation failed because the user did not provide the necessary information, specifically the area name, for the new school to be added.","Right;Reason:the student gives the same reason as the teacher for the operation's failure, which aligns with the teacher's explanation.",
nicknameADMIN,Please Add a new school whose name is MyNewSchool, failed because user does not specify the area of the added school,the operation failed because you did not provide the required area name for the new school.,Right;Reason:the student reply fail and give a same reason as the teacher.,
nickname2875759,Tell me information about users called Andy,You are not admin,the operation failed because you are not an admin and do not have the necessary permission to view information about users in the system.,Right;Reason:the student reply fail and give a same reason as the teacher.,
nickname2875759,Tell me information about users whose name is Andy,You are not admin,the operation failed because you do not have the necessary administrative permissions to access information about users with the name Andy in the system.,Right;Reason:the student reply fail and give a same reason as the teacher.,
nickname2875759,"Tell me information about Andy, a user in the system",You are not admin,the operation failed because the user giving the query is not an admin and does not have the necessary rights to access information about other users in the system.,Right;Reason:the student reply fail and give a same reason as the teacher.,
nickname2875759,Tell me information about Andy,You are not admin,The answer states that information about Andy is not included in the query and directs the user to contact human customer service for assistance.,"Wrong;Reason:the student reply does not align with the reason provided by the teacher which is not having admin privileges, instead introduces a completely different reason for the failure.",wrong
nicknameADMIN,Tell me information about users called Andy,the user is a teamleader,"Andy is a team leader with ID 1601, school ID 174, and upload limit of 100.","Right;Reason:the student reply provides the same information as the teacher and adds extra details, which is acceptable.",
nicknameADMIN,Tell me information about users whose name is Andy,the user is a teamleader,"the user named Andy is a team leader with the user id 1601, school id 174, and upload limit of 100.",Right;Reason:the student reply with extra information which is correct and aligns with the teacher's reply about the user's role.,
nicknameADMIN,"Tell me information about Andy, a user in the system",the user is a teamleader,"Andy is a team leader in the system, has been approved, and does not have any problem or answer sheets to mark.","Right;Reason:the student reply includes the same core information as the teacher and adds additional, non-contradictory details.",
nicknameADMIN,Tell me information about Andy,the user is a teamleader,Andy is a team leader at school ID 174 with an upload limit of 100 and 5 viewing problems.,"Right;Reason:the student reply provides the same information as the teacher and adds additional details, which is acceptable.",
nicknameADMIN,Tell me information about users called Bob,No such user exists.,there is no user in the system named Bob.,Right;Reason:the student reply aligns with the teacher's information stating no such user exists.,
nicknameADMIN,Tell me information about users whose name is Bob,No such user exists.,there is no user in the system with the name Bob.,Right;Reason:the student's reply aligns with the teacher's response regarding the non-existence of the user.,
nicknameADMIN,"Tell me information about Bob, a user in the system",No such user exists.,"Bob is a team leader in the system, approved, and has no problem or answer sheets to mark.","Wrong;Reason:the student provides information about a user named Bob implying his existence and role, contradicting the teacher's reply that no such user exists.",wrong
nicknameADMIN,Tell me information about Bob,No such user exists.,there is no teacher named Bob in the system.,"Wrong;Reason:the student specifies ""teacher"" while the teacher's reply did not specify the type of user, making the student's reply too specific and potentially inaccurate.",should be correct
nickname2875759,Tell me information about users in the school schoolname344263,You are not admin,the operation failed because the user is not an admin and does not have the necessary permission to access information about users in the school schoolname344263.,Right;Reason:the student reply fail and give a same reason as the teacher.,
nickname2875759,Tell me information about users of the school schoolname344263,You are not admin,the operation failed because you are not an admin and do not have the right to view information about users in the system.,Right;Reason:the student reply fail and give a same reason as the teacher.,
nickname2875759,Tell me information about users who are in the school schoolname344263,You are not admin,the operation failed because you are not an admin and do not have the necessary permissions to access information about users in the system.,Right;Reason:the student reply fail and give a same reason as the teacher.,
nickname2875759,Tell me information about users within the school schoolname344263,You are not admin,the operation failed because you do not have administrative privileges to access information about users within the specified school.,Right;Reason:the student reply fail and give a same reason as the teacher.,
nicknameADMIN,Please change me into an arbiter, successfully changed you into an arbiter,the operation to change your user type to arbiter was successful.,Right;Reason:the student reply success which aligns with the teacher in terms of reply to the instruction.,
nicknameADMIN,Please make me an arbiter, successfully changed you into an arbiter,"The user's request to be made an arbiter was confirmed, stating that they are already an approved arbiter in the system with no problem or answer sheets currently available for them to mark.","Right;Reason:the student reply success which aligns with the teacher in terms of reply to the instruction, and also provides extra information about the current status of the user as an arbiter, which is acceptable.",
nicknameADMIN,Please let me be an arbiter, successfully changed you into an arbiter,"The individual is already an approved arbiter in the system, but there are currently no problem or answer sheets for them to mark.","Wrong;Reason:the student adds information suggesting the individual is already an arbiter and mentions a lack of problem or answer sheets, which is not related to the teacher's confirmation of a successful change.",should be correct
nicknameADMIN,Please modify my profile so that I will be an arbiter, successfully changed you into an arbiter,your profile has been successfully modified to make you an arbiter.,Right;Reason:the student reply success which aligns with the teacher in term of reply to the instruction.,
nicknameADMIN,Please change me into a vice team leader of the teacher named name2258317,successfully changed you into the vice team leader of the teacher named name2258317,the user has been successfully changed into a vice team leader of the teacher named name2258317.,Right;Reason:the student reply success which aligns with the teacher in terms of reply to the instruction.,
nicknameADMIN,Please change me into a vice team leader of the teacher whose name is name2258317,successfully changed you into the vice team leader of the teacher named name2258317,the user has been successfully changed to a vice team leader of the teacher named name2258317.,Right;Reason:the student reply success which aligns with the teacher in term of reply to the instruction.,
nicknameADMIN,Please change me into a vice team leader of the teacher with name name2258317,successfully changed you into the vice team leader of the teacher named name2258317,you have been successfully changed to a vice team leader of the teacher with the name name2258317.,Right;Reason:the student reply success which aligns with the teacher in terms of reply to the instruction.,
nicknameADMIN,Please change me into a vice team leader of the teacher called name2258317,successfully changed you into the vice team leader of the teacher named name2258317,the user has been successfully changed into a vice team leader of the teacher named name2258317.,Right;Reason:the student reply success which aligns with the teacher in terms of reply to the instruction.,
nickname2875759,Please change my marking subject into 11.,failed because the markign subject must be 1-10.,"the marking subject must be between 1 and 10, so changing it to 11 is not allowed.",Right;Reason:the student provides the same crucial information as the teacher regarding the limitation on the range of marking subjects.,
nickname2875759,Please change the subject I mark into 12.,failed because the markign subject must be 1-10.,the operation failed because the marking subject must be within the range of 1 to 10.,Right;Reason:the student reply fail and give a same reason as the teacher.,
nickname2875759,Please change the problem I view into 12.,failed because the markign subject must be 1-10.,the operation failed because the marking subject must be within the range of 1 to 10.,Right;Reason:the student reply fail and give the same reason as the teacher.,
nickname2875759,Please change my subject to mark into 11.,failed because the markign subject must be 1-10.,"the marking subject must be between 1 and 10, so changing it to 11 is not allowed.",Right;Reason:the student reply fail and give a same reason as the teacher.,
Auto-checked Correctly answered number: 93/104,Auto-checked Wrongly answered number: 11/104,,,,should be 4/104 wrong.
